Название;Средний балл ЕГЭ;Рост/Падение;Количество студентов, зачисленных на бюджет;Количество БВИ;Средний балл с вычетом ИД?;Форма обучения;Количество бюджетных мест на специальности;Средний балл;Стоимость;Форма обучения;Количество бюджетных мест на специальности;Средний балл;Стоимость;Id лого;Адрес;Наличие военной кафедры;Наличие отсрочки от армии;Ссылка на документ о приеме
 Алтайский государственный университет ; 74.4; 1.7; 1420; 23; Да;бакалавриат;33;165.0;119500;0;0;0;0;fada72f4-aab6-439a-9ee4-a0871d3669f0;РОССИЯ, 656038, Алтайский край, Барнаул г, Ленина пр-кт, дом 46;True;False;https://www.altstu.ru/media/f/KCP-2022-dlya-sajta.pdf
 Владимирский государственный университет; 64.0; -1.9; 1420; 0; Да;бакалавриат;12;123.0;126000;магистратура;10;44.0;135490;73d9f15a-7469-4a82-8a6f-2d21b03fd7d7;600000, г.Владимир, ул.Горького, 87;False;True;https://prkom.vlsu.ru/plan.html
 Волгоградский государственный университет; 69.0; -0.9; 969; 1; Да;бакалавриат;8;217.0;122000;0;0;0;0;630dd527-b5c6-45bd-81b1-48a876f68301;400062, Волгоградская область, г. Волгоград, просп. Университетский, д. 100;False;False;https://volsu.ru/Abitur/plany-priema.php
 Воронежский государственный технический университет; 66.2; 2; 1942; 6; Нет;бакалавриат;28;123.0;115800;магистратура;11;35.0;122860;cefffdd8-1e73-49e7-b507-eafa1da4f8f9;394006, г. Воронеж, ул. 20-летия Октября, 84;True;True;https://cchgeu.ru/upload/abiturientu/info/2020/Plan-priema-2021.pdf
 Воронежский государственный университет; 74.2; -0.2; 1734; 4; Нет;бакалавриат;28;123.0;115800;магистратура;11;35.0;122860;cefffdd8-1e73-49e7-b507-eafa1da4f8f9;394006, г. Воронеж, ул. 20-летия Октября, 84;True;True;https://cchgeu.ru/upload/abiturientu/info/2020/Plan-priema-2021.pdf
 Вятский государственный университет ; 68.2; 0.1; 1827; 2; Да;бакалавриат;14;199.0;115177;0;0;0;0;ddab0f07-50d1-40a6-850b-e53d590d9671;610000, Кировская область, г. Киров, ул. Московская, д. 36;False;False;https://new.vyatsu.ru/upload/iblock/31d/fyp76ft0gi6yydool30dv90he6oc54rn.pdf
 Дальневосточный федеральный университет; 73.0; -0.3; 2649; 25; Нет;бакалавриат;25;161.0;210000;магистратура;22;0.0;290000;b1d399f2-cba7-428e-83a0-8f648c08f7aa;690950, Приморский край, г. Владивосток, ул. Суханова, д. 8;True;True;https://www.dvfu.ru/upload/medialibrary/4e4/cmsvctuegg5miib715u5ecte4x9mhmo0/%D0%9A%D0%BE%D0%BB%D0%B8%D1%87%D0%B5%D1%81%D1%82%D0%B2%D0%BE%20%D0%B1%D1%8E%D0%B4%D0%B6%D0%B5%D1%82%D0%BD%D1%8B%D1%85%20%D0%BC%D0%B5%D1%81%D1%82%20%D0%B4%D0%BB%D1%8F%20%D0%BF%D1%80%D0%B8%D0%B5%D0%BC%D0%B0%202022-23%20%D0%BF%D0%BE%20%D0%BF%D1%80%D0%BE%D0%B3%D1%80%D0%B0%D0%BC%D0%BC%D0%B0%D0%BC%20%D0%B1%D0%B0%D0%BA%D0%B0%D0%BB%D0%B0%D0%B2%D1%80%D0%B8%D0%B0%D1%82%D0%B0%20%D0%B8%20%D0%BF%D1%80%D0%BE%D0%B3%D1%80%D0%B0%D0%BC%D0%BC%D0%B0%D0%BC%20%D1%81%D0%BF%D0%B5%D1%86%D0%B8%D0%B0%D0%BB%D0%B8%D1%82%D0%B5%D1%82%D0%B0.pdf
 Донской государственный технический университет ; 62.2; 0.8; 2865; 0; Да;бакалавриат;22;121.0;29100;0;0;0;0;1b74b22d-82f8-4d72-8c34-9c031d174bc5;344003, г.Ростов-на-Дону, пл.Гагарина, 1;True;True;https://donstu.ru/priemnaya-kampaniya/
 Казанский национальный исследовательский технологический университет; 67.0; -2; 1819; 0; Да;бакалавриат;22;185.0;155400;магистратура;12;40.0;49800;8fc8bb73-b6c9-4d53-b456-9fe66bc303b6;420015, Республика Татарстан, г.Казань, ул. К. Маркса, д.68;True;True;https://www.kstu.ru/article.jsp?id=2813&id_e=58594
 Казанский (Приволжский) федеральный университет; 80.0; -0.5; 2893; 10; Да;бакалавриат;25;255.0;150840;магистратура;8;0.0;160740;cf12a1e1-a102-467f-a2df-f2a96ef1e8ad;420008, Республика Татарстан, г. Казань, ул. Кремлевская, д.18;False;True;https://admissions.kpfu.ru/priem-v-universitet/plan-priema-2021-kolichestvo-mest-vstupitelnye-ispytaniya-i-minimalnye-bally
 Кубанский государственный университет ; 76.6; 0.2; 1766; 7; Да;бакалавриат;20;217.0;135000;0;0;0;0;9476cfaa-2a3e-4135-9b62-954a0e5bbc48;350040, г.Краснодар, ул.Ставропольская, 149;False;True;https://www.kubsu.ru/sites/default/files/insert/page/2022_places_b_0.pdf
 Кузбасский государственный технический университет имени Т.Ф. Горбачева ; 58.2; -1.4; 826; 0; Да;бакалавриат;;;;0;0;0;0;4cc6afb0-3237-43f2-93a5-e137e0fd6485;650000, г.Кемерово, ул.Весенняя, д.28;True;True;https://kuzstu.ru/abiturientu/tsifri-priema/bakalavriat-spetsialitet-golovnoi-vuz-i-filiali/
 МИРЭА - Российский технологический университет; 81.5; 1.6; 3031; 54; Да;бакалавриат;65;241.0;192000;0;0;0;0;fa7b2da0-a4f0-466b-a6cc-363b8a4f9b10;119454, г. Москва, просп. Вернадского, д. 78;True;True;https://priem.mirea.ru/first-degree/list/head
 Московский авиационный институт (национальный исследовательский университет); 78.5; 1; 2790; 22; Да;бакалавриат;22;207.0;;магистратура;18;;232000;f43a93df-e3d5-401e-93a4-671357cffc11;125993, г.Москва, Волоколамское шоссе, д.4;True;True;https://mai.ru/science/postgraduate/kcp/
 Московский государственный технический университет имени Н.Э. Баумана; 82.7; 0.8; 3551; 201; Да;бакалавриат;33;258.0;302533;0;0;0;0;4477ba99-638d-4c7d-91eb-288dfbcee2ae;105005, г.Москва, 2-я Бауманская ул., д.5;True;True;https://api.www.bmstu.ru/file/89037/download
 Московский государственный университет имени М.В. Ломоносова; 90.2; -0.6; 3835; 496; Да;бакалавриат;;;;магистратура;;;;c0e2707c-2b2c-4ad6-833f-84d1c7a4f2df;119991,г. Москва, Ленинские Горы,д.1;True;True;http://cpk.msu.ru/files/2021/kcp_bak.pdf
 Московский политехнический университет; 76.1; 2.5; 1756; 35; Да;бакалавриат;20;228.0;251100;0;0;0;0;d9fd69da-2f68-4a93-aae0-6058fc175c09;107023 г. Москва, ул. Большая Семеновская д.38;False;True;https://new.mospolytech.ru/postupayushchim/priem-v-universitet/pravila-priema/
 Национальный исследовательский Томский государственный университет; 80.1; 0.7; 2109; 127; Да;бакалавриат;;;;магистратура;;;;9dcc834c-4241-4fcd-b482-005315a24f28;634050, г. Томск, пр. Ленина 36;True;True;http://abiturient.tsu.ru/sites/default/files/prilozhenie_1.1_bakalavriat_i_specialitet_16032021.pdf
 Национальный исследовательский Томский политехнический университет; 74.8; -3.2; 1809; 54; Нет;бакалавриат;30;229.0;98480;магистратура;10;73.0;109980;29ca77c0-5f4a-41f8-affb-02c84cc42b09;634050, Томская область, г. Томск, просп. Ленина, д. 30;True;True;https://abiturient.tpu.ru/uploads/008e90e7daf883a68d53ac2e7a09ec8f.pdf
 Нижегородский государственный архитектурно-строительный университет; 69.2; -1.3; 732; 0; Нет;бакалавриат;0;0.0;45000;магистратура;0;0.0;60000;e840fa81-67ac-4b9d-9f18-5beb42d239bd;603950 г.Нижний Новгород ул.Ильинская, д. 65;False;True;https://nngasu.ru/entrant/2021_%D0%B1%D0%B0%D0%BA-%D1%81%D0%BF%D0%B5%D1%86_%D0%9F%D1%80%D0%B8%D0%BB%D0%BE%D0%B6%D0%B5%D0%BD%D0%B8%D0%B5%201%20(%D0%BA%D0%BE%D0%BB%D0%B8%D1%87%D0%B5%D1%81%D1%82%D0%B2%D0%BE%20%D0%BC%D0%B5%D1%81%D1%82)___.pdf
 Омский государственный технический университет; 64.4; 0.9; 1891; 1; Нет;бакалавриат;18;180.0;0;0;0;0;0;f690fe88-dbfe-4589-a0e5-ed63672bd15f;644050, г.Омск, пр. Мира, 11;True;True;https://www.omgtu.ru/entrant/regulatory-documents-for-entering-in-2019-bachelor-specialist-master/%D0%9F%D1%80%D1%82-11-30.10.2020-%D0%9A%D0%BE%D0%BB%D0%9C%D0%B5%D1%81%D1%82.pdf
 Омский государственный университет путей сообщения; 54.8; -2.4; 763; 0; Нет;бакалавриат;0;0.0;44600;магистратура;0;0.0;54300;40ee7bc7-b3d9-42cf-adb5-d649c18ee2d8;644046, г.Омск, пр.Маркса, д.35;False;True;https://www.omgups.ru/abitur/plan-priema/
 Поволжский государственный технологический университет ; 68.3; 2.4; 1301; 0; Нет;бакалавриат;14;168.0;114600;магистратура;7;40.0;121250;9c9410df-579c-43e3-bb09-747054f829f0;424000, Республика Марий Эл, г.Йошкар-Ола, пл. Ленина, д.3;False;True;https://dod.volgatech.net/documents/
 Поволжский государственный университет телекоммуникаций и информатики ; 62.7; 0.4; 820; 0; Нет;бакалавриат;20;154.0;53000;0;0;0;0;3548a7bd-4d11-4bfb-82f3-bcfd10270e04;443010, г.Самара, Льва Толстого, д.23;False;True;https://abitur.psuti.ru/priemnaya-kampaniya-2021/Kol-vo-mest-priyoma-2021.pdf
 Российский университет транспорта (МИИТ); 64.0; 0.2; 1757; 0; Да;бакалавриат;12;232.0;288000;магистратура;6;;120000;d6e69957-30ea-4a5e-8cf1-99af5e85e42e;127994, г. Москва, ул. Образцова, д. 9, стр. 9;True;True;https://www.miit.ru/admissions/degrees?year=2021&city=1&level=4&training=20773
 Санкт-Петербургский государственный университет; 92.0; 0.1; 2136; 366; Да;бакалавриат;20;224.0;214000;магистратура;14;73.0;195000;2fc60042-fdbe-4be4-a676-078abf1bdfe0;190000, г.Санкт-Петербург, ул.Большая Морская, д.67, лит.А;True;True;https://priem.guap.ru/calc
 Санкт-Петербургский государственный университет аэрокосмического приборостроения; 81.3; 3.8; 1356; 11; Нет;бакалавриат;20;224.0;214000;магистратура;15;0.0;230000;2fc60042-fdbe-4be4-a676-078abf1bdfe0;190000, г.Санкт-Петербург, ул.Большая Морская, д.67, лит.А;True;True;https://priem.guap.ru/calc
 Санкт-Петербургский политехнический университет Петра Великого; 82.6; 0.2; 2958; 133; Да;бакалавриат;0;0.0;80000;магистратура;0;0.0;94000;e3d73e9c-9ffd-46e8-a231-64ba108cb256;195251, г.Санкт-Петербург, ул.Политехническая, 29;True;True;https://www.spbstu.ru/abit/bachelor/apply/perechen-napravleniy-podgotovki/
 Саратовский национальный исследовательский государственный университет имени Н. Г. Чернышевского; 69.9; 1.2; 1568; 3; Да;бакалавриат;;;;0;0;0;0;c8963b8c-56ef-4480-8fd1-69d204ca9855;410012, г.Саратов, ул.Астраханская, 83;False;True;https://www.sgu.ru/admission/priemnaya-kampaniya-2022
 Сибирский государственный университет геосистем и технологий ; 67.8; -1; 489; 0; Нет;бакалавриат;0;0.0;40812;0;0;0;0;56a52ade-1d79-499e-9a26-0d364402e32e;630108, г. Новосибирск, ул. Плахотного, д. 10;False;True;https://sgugit.ru/abitur/bachelor/#abitur_plan_priema
 Сибирский федеральный университет; 70.1; -1; 3337; 8; Да;бакалавриат;24;157.0;176934;магистратура;11;41.0;188584;ed090e19-9cf6-40f3-b40d-d4f69a2aabea;660041, Красноярский край, г. Красноярск, просп. Свободный, д. 79;True;True;https://admissions.sfu-kras.ru/exams
 Тверской государственный университет; 68.6; -3.5; 856; 0; Да;бакалавриат;26;;130380;0;0;0;0;b67da480-580c-4c77-b250-85a53beb6942;170100, г. Тверь, ул.Желябова, 33;False;True;https://priem.tversu.ru/
 Томский государственный университет систем управления и радиоэлектроники; 68.7; -0.3; 1236; 3; Нет;бакалавриат;10;150.0;76266;магистратура;5;50.0;130000;86d8ad91-16a5-492e-89c4-f89e877684aa;634050, Россия, г. Томск, пр. Ленина, 40;False;True;https://abiturient.tusur.ru/storage/139741/KCP-byudzhet_i_PVZ_ochnoe_na_2021_na_AJT%2029_10.pdf
 Тюменский индустриальный университет; 66.1; -1; 2206; 2; Да;бакалавриат;26;201.0;165000;0;0;0;0;f2954ac7-d586-4f62-a46e-1281bb11f417;625000, Тюменская область, г. Тюмень, ул. Володарского, д. 38;False;False;https://www.tyuiu.ru/abitur/
 Ульяновский государственный технический университет; 66.8; 0.8; 888; 1; Да;бакалавриат;12;160.0;111580;магистратура;0;0.0;44700;aacb4345-caf2-4e42-be39-1675efdd8046;432027, г.Ульяновск, ул.Северный Венец, 32;False;True;https://ulstu.ru/upload/iblock/fe0/KCP_C_2021.pdf
 Ульяновский государственный университет; 66.3; -1; 853; 0; Нет;бакалавриат;12;160.0;111580;магистратура;0;0.0;44700;aacb4345-caf2-4e42-be39-1675efdd8046;432027, г.Ульяновск, ул.Северный Венец, 32;False;True;https://ulstu.ru/upload/iblock/fe0/KCP_C_2021.pdf
 Уральский федеральный университет имени Б.Н. Ельцина; 76.2; -1.4; 4422; 122; Да;бакалавриат;55;221.0;130400;магистратура;23;80.0;126400;f255a4e8-15cf-45d0-a121-19f6f61d0c5d;620002, Свердловская область, г. Екатеринбург, ул. Мира, д. 19;True;True;https://urfu.ru/fileadmin/user_upload/urfu.ru/documents/applicant/2021/postuplenie-vo/Plan_priema_bakalavriat_specialitet_2021.pdf
 Уфимский государственный авиационный технический университет; 69.2; -1.2; 1404; 7; Нет;бакалавриат;0;0.0;54000;0;0;0;0;6119c816-9894-47f3-8d85-188bba571e88;450000, Республика Башкортостан, г. Уфа, ул. К. Маркса, д. 12;True;True;https://ugatu.su/abitur/bachelor-and-specialist/admission-plan/2022/
 Чувашский государственный университет имени И.Н. Ульянова ; 70.3; 0.9; 1296; 1; Да;бакалавриат;0;0.0;27500;0;0;0;0;8a6c9f76-166b-4805-8c42-fdf474e8aff6;428015, г.Чебоксары  Московский проспект,15;False;True;https://abiturient.chuvsu.ru/urovni/bakalavriat/byudzhetnye-mesta
 Южный федеральный университет; 76.7; 0.2; 3088; 34; Да;бакалавриат;30;177.0;130000;0;0;0;0;496e4998-457b-4fed-bc13-18b6158ac498;344006, г.Ростов-на-Дону, ул.Большая Садовая, д. 105/42;True;True;https://sfedu.ru/www/stat_pages22.show?p=ABT/N8206/P
