Название;Средний балл ЕГЭ;Рост/Падение;Количество студентов, зачисленных на бюджет;Количество БВИ;Средний балл с вычетом ИД?;Форма обучения;Количество бюджетных мест на специальности;Средний балл;Стоимость;Форма обучения;Количество бюджетных мест на специальности;Средний балл;Стоимость;Id лого;Адрес;Наличие военной кафедры;Наличие отсрочки от армии;Ссылка на документ о приеме
 Волгоградский государственный технический университет; 64.2; 0.3; 1198; 0; Да;бакалавриат;40;131.0;126250;магистратура;6;67.0;134170;47876a8f-55b1-4cf0-b247-867a9a3add86;400005, г. Волгоград, проспект им. Ленина, д.28;False;True;https://welcome.vstu.ru/acceptance/Abitur/#kolmest
 Волгоградский государственный университет; 69.0; -0.9; 969; 1; Да;бакалавриат;40;131.0;126250;магистратура;6;67.0;134170;47876a8f-55b1-4cf0-b247-867a9a3add86;400005, г. Волгоград, проспект им. Ленина, д.28;False;True;https://welcome.vstu.ru/acceptance/Abitur/#kolmest
 Воронежский государственный технический университет; 66.2; 2; 1942; 6; Нет;бакалавриат;25;118.0;115800;0;0;0;0;cefffdd8-1e73-49e7-b507-eafa1da4f8f9;394006, г. Воронеж, ул. 20-летия Октября, 84;True;True;https://cchgeu.ru/upload/abiturientu/info/2020/Plan-priema-2021.pdf
 Воронежский государственный университет; 74.2; -0.2; 1734; 4; Нет;бакалавриат;25;118.0;115800;0;0;0;0;cefffdd8-1e73-49e7-b507-eafa1da4f8f9;394006, г. Воронеж, ул. 20-летия Октября, 84;True;True;https://cchgeu.ru/upload/abiturientu/info/2020/Plan-priema-2021.pdf
 Восточно-Сибирский государственный университет технологий и управления ; 52.2; -3.8; 588; 0; Да;бакалавриат;0;0.0;147000;магистратура;;;;4d3bda30-8650-40c7-93f2-3d7302eee693;670013, Республика Бурятия, г.Улан-Удэ, ул.Ключевская, д.40В, строение 1;True;True;https://www.esstu.ru/uportal/document/download.htm?documentId=23749
 Вятский государственный университет ; 68.2; 0.1; 1827; 2; Да;бакалавриат;10;118.0;115177;0;0;0;0;ddab0f07-50d1-40a6-850b-e53d590d9671;610000, Кировская область, г. Киров, ул. Московская, д. 36;False;False;https://new.vyatsu.ru/upload/iblock/31d/fyp76ft0gi6yydool30dv90he6oc54rn.pdf
 Донской государственный технический университет ; 62.2; 0.8; 2865; 0; Да;бакалавриат;40;130.0;125900;0;0;0;0;1b74b22d-82f8-4d72-8c34-9c031d174bc5;344003, г.Ростов-на-Дону, пл.Гагарина, 1;True;True;https://donstu.ru/priemnaya-kampaniya/
 Липецкий государственный технический университет; 63.4; -1.7; 571; 0; Нет;бакалавриат;0;0.0;54400;магистратура;0;0.0;57800;6482f0de-7da1-48ee-9c00-be821a58f0c4;398055, г. Липецк, ул. Московская, д. 30;False;True;https://www.stu.lipetsk.ru/struct/management/rector/pk/res/abit2022/stages/stage-main/b-3-mesta.pdf
 Московский авиационный институт (национальный исследовательский университет); 78.5; 1; 2790; 22; Да;бакалавриат;21;190.0;;магистратура;28;;232000;f43a93df-e3d5-401e-93a4-671357cffc11;125993, г.Москва, Волоколамское шоссе, д.4;True;True;https://mai.ru/science/postgraduate/kcp/
 Московский политехнический университет; 76.1; 2.5; 1756; 35; Да;бакалавриат;19;165.0;95100;магистратура;22;40.0;95200;d9fd69da-2f68-4a93-aae0-6058fc175c09;107023 г. Москва, ул. Большая Семеновская д.38;False;True;https://new.mospolytech.ru/postupayushchim/priem-v-universitet/pravila-priema/
 Национальный исследовательский Томский политехнический университет; 74.8; -3.2; 1809; 54; Нет;бакалавриат;25;194.0;172740;0;0;0;0;29ca77c0-5f4a-41f8-affb-02c84cc42b09;634050, Томская область, г. Томск, просп. Ленина, д. 30;True;True;https://abiturient.tpu.ru/uploads/008e90e7daf883a68d53ac2e7a09ec8f.pdf
 Пермский национальный исследовательский политехнический университет; 69.0; -0.2; 1822; 0; Нет;бакалавриат;18;137.0;147000;магистратура;0;0.0;60000;acf8d4f4-c1ba-433c-821e-7762d24b69fa;614990, г.Пермь, Комсомольский проспект, д. 29;False;True;https://pstu.ru/files/2/file/enrollee/!PLAN_priema_2021_2.pdf
 Рыбинский государственный авиационный технический университет имени П.А. Соловьева; 60.5; -0.8; 391; 0; Да;бакалавриат;0;0.0;49900;0;0;0;0;8221a36b-e8ed-49aa-93aa-cf8c116d1f0f;152934, Ярославская область, г.Рыбинск, ул.Пушкина, д.53;False;True;https://rsatu.ru/applicants/bakalavriat-i-spetsialitet/
 Самарский государственный технический университет; 68.1; 1; 2012; 6; Нет;бакалавриат;18;138.0;119000;магистратура;8;78.0;126260;38cde29e-6691-481d-b30f-79282fbd19a5;443100, г.Самара, ул.Молодогвардейская, 244;True;True;https://samgtu.ru/uploads/admission/2022/kcp_2022.pdf
 Самарский национальный исследовательский университет имени академика С.П. Королева; 75.0; -0.2; 2016; 16; Нет;бакалавриат;32;160.0;138600;магистратура;0;0.0;147500;38145b24-9064-42d1-ae3d-25f70fec0041;443086, г.Самара, Московское шоссе, д.34а;True;True;https://ssau.ru/files/priem_doc/bachelor/2021/rasp_9_2021.pdf
 Санкт-Петербургский горный университет; 80.8; 2.3; 1831; 64; Нет;бакалавриат;24;226.0;400000;магистратура;10;181.0;400000;37c9158f-99fb-4790-a7bc-749dd3ba2c45;199106, г.Санкт-Петербург, 21-я линия, д.2;True;True;https://priem.spmi.ru/sites/default/files/manager/03.PlanPriema/KCP.pdf
 Санкт-Петербургский политехнический университет Петра Великого; 82.6; 0.2; 2958; 133; Да;бакалавриат;0;0.0;80000;магистратура;8;50.0;220000;e3d73e9c-9ffd-46e8-a231-64ba108cb256;195251, г.Санкт-Петербург, ул.Политехническая, 29;True;True;https://www.spbstu.ru/abit/bachelor/apply/perechen-napravleniy-podgotovki/
 Саратовский государственный технический университет; 66.5; 1.8; 1098; 0; Нет;бакалавриат;0;130.0;53470;магистратура;0;70.0;119810;06d0f532-f5cb-4cfe-abbf-05f72e0cc05a;410054, г.Саратов, ул.Политехническая, д. 77;True;True;https://www.sstu.ru/upload/medialibrary/86b/Kol_mest_VO_2021_bak_i_spets_mart_21-_2_.docx
 Северо-Кавказский горно-металлургический институт (государственный технологический университет) ; 52.8; -6; 617; 0; Да;бакалавриат;14;133.0;19000;магистратура;;;;11088c88-8647-40f8-ab18-1c4e9e28c822;РСО-Алания, г. Владикавказ, ул. Николаева, 44;False;True;http://www.skgmi-gtu.ru/ru-ru/abitur
 Сибирский государственный индустриальный университет ; 65.3; 2.3; 1095; 1; Нет;бакалавриат;19;120.0;41480;магистратура;7;50.0;74475;aa29b86f-5cf0-418b-9b31-fa9d4421f3e9;654007, Кемеровская область - Кузбасс, г. Новокузнецк, Центральный р-н, ул. Кирова, зд. 42;False;True;https://www.sibsiu.ru/abiturientu/AbitReport/index2.php?sphrase_id=454970
 Сибирский федеральный университет; 70.1; -1; 3337; 8; Да;бакалавриат;40;170.0;46928;магистратура;88;41.0;188584;ed090e19-9cf6-40f3-b40d-d4f69a2aabea;660041, Красноярский край, г. Красноярск, просп. Свободный, д. 79;True;True;https://admissions.sfu-kras.ru/exams
 Уральский федеральный университет имени Б.Н. Ельцина; 76.2; -1.4; 4422; 122; Да;бакалавриат;0;0.0;78000;магистратура;29;56.0;93000;f255a4e8-15cf-45d0-a121-19f6f61d0c5d;620002, Свердловская область, г. Екатеринбург, ул. Мира, д. 19;True;True;https://urfu.ru/fileadmin/user_upload/urfu.ru/documents/applicant/2021/postuplenie-vo/Plan_priema_bakalavriat_specialitet_2021.pdf
 Череповецкий государственный университет; 65.7; 0.4; 967; 0; Нет;бакалавриат;20;225.0;25300;магистратура;18;70.0;72651;4968869f-f085-4c90-b3ae-6f8a78695407;162600, Россия, Вологодская область, г. Череповец, проспект Советский, д.10;False;True;https://pk.chsu.ru/dokumenty/podannye-zayavleniya.php
 Южно-Российский государственный политехнический университет имени М.И. Платова ; 59.5; 2.2; 942; 1; Да;бакалавриат;;;;магистратура;0;0.0;116340;14aa519e-7f4f-4468-9b64-1d691477f44b;346428, Ростовская область, г.Новочеркасск, ул. Просвещения 132;True;True;https://abiturient.npi-tu.ru/assets/files/docs/2021/%D0%A1%D0%B2%D0%B5%D0%B4%D0%B5%D0%BD%D0%B8%D1%8F%20%D0%BE%20%D0%BA%D0%BE%D0%BB%D0%B8%D1%87%D0%B5%D1%81%D1%82%D0%B2%D0%B5%20%D0%BC%D0%B5%D1%81%D1%82%20%D0%B4%D0%BB%D1%8F%20%D0%BF%D1%80%D0%B8%D0%B5%D0%BC%D0%B0%20%D0%B3%D1%80%D0%B0%D0%B6%D0%B4%D0%B0%D0%BD%20%D0%AE%D0%A0%D0%93%D0%9F%D0%A3%20(%D0%9D%D0%9F%D0%98)%20%D0%B8%D0%BC.%20%D0%9C.%D0%98.%D0%9F%D0%BB%D0%B0%D1%82%D0%BE%D0%B2%D0%B0.pdf
