Название;Средний балл ЕГЭ;Рост/Падение;Количество студентов, зачисленных на бюджет;Количество БВИ;Средний балл с вычетом ИД?;Форма обучения;Количество бюджетных мест на специальности;Средний балл;Стоимость;Форма обучения;Количество бюджетных мест на специальности;Средний балл;Стоимость;Id лого;Адрес;Наличие военной кафедры;Наличие отсрочки от армии;Ссылка на документ о приеме
 Алтайский государственный университет ; 74.4; 1.7; 1420; 23; Да;бакалавриат;9;244.0;101240;магистратура;;;;bd295655-44d9-4ebf-aacf-532fa788e1d3;656049, Алтайский край, г. Барнаул, ул. Ленина, д. 61;False;False;https://www.asu.ru/files/documents/00025000.pdf
 Дагестанский государственный университет ; 63.0; -0.4; 1025; 19; Нет;бакалавриат;0;0.0;21510;0;0;0;0;ae7078a1-9027-4024-af9a-7275afdd1596;367000, Республика Дагестан, г.Махачкала, ул. Батырая, 2, Дворец спорта ДГУ;False;True;http://dgu.ru/Abitur/?id=15247
 Казанский (Приволжский) федеральный университет; 80.0; -0.5; 2893; 10; Да;бакалавриат;4;260.0;132360;0;0;0;0;cf12a1e1-a102-467f-a2df-f2a96ef1e8ad;420008, Республика Татарстан, г. Казань, ул. Кремлевская, д.18;False;True;https://admissions.kpfu.ru/priem-v-universitet/plan-priema-2021-kolichestvo-mest-vstupitelnye-ispytaniya-i-minimalnye-bally
 Московский государственный университет имени М.В. Ломоносова; 90.2; -0.6; 3835; 496; Да;бакалавриат;;;;магистратура;;;;c0e2707c-2b2c-4ad6-833f-84d1c7a4f2df;119991,г. Москва, Ленинские Горы,д.1;True;True;http://cpk.msu.ru/files/2021/kcp_bak.pdf
 Национальный исследовательский Томский государственный университет; 80.1; 0.7; 2109; 127; Да;бакалавриат;;;;магистратура;;;;9dcc834c-4241-4fcd-b482-005315a24f28;634050, г. Томск, пр. Ленина 36;True;True;http://abiturient.tsu.ru/sites/default/files/prilozhenie_1.1_bakalavriat_i_specialitet_16032021.pdf
 Саратовский национальный исследовательский государственный университет имени Н. Г. Чернышевского; 69.9; 1.2; 1568; 3; Да;бакалавриат;;;;0;0;0;0;c8963b8c-56ef-4480-8fd1-69d204ca9855;410012, г.Саратов, ул.Астраханская, 83;False;True;https://www.sgu.ru/admission/priemnaya-kampaniya-2022
