Название;Средний балл ЕГЭ;Рост/Падение;Количество студентов, зачисленных на бюджет;Количество БВИ;Средний балл с вычетом ИД?;Форма обучения;Количество бюджетных мест на специальности;Средний балл;Стоимость;Форма обучения;Количество бюджетных мест на специальности;Средний балл;Стоимость;Id лого;Адрес;Наличие военной кафедры;Наличие отсрочки от армии;Ссылка на документ о приеме
 Алтайский государственный университет ; 74.4; 1.7; 1420; 23; Да;бакалавриат;24;119.0;142000;магистратура;;;;ca7848f5-a655-4dd5-be23-7923e80eed77;649000, Республика Алтай, г.Горно-Алтайск, ул.Ленкина, 1;False;False;http://abit.gasu.ru/index.php?option=com_content&view=article&id=203&Itemid=523
 Астраханский государственный университет; 63.9; -2.2; 695; 1; Да;бакалавриат;14;150.0;125353;магистратура;10;90.0;132956;4ae7d82f-0812-449e-9384-407d39da5836;414056, Россия, г. Астрахань, ул. Татищева, 20а;True;False;https://asu.edu.ru/images/File/priem/2022/OBShchEE-KOL-VO-MEST.pdf
 Башкирский государственный университет ; 67.6; -2.1; 1011; 4; Да;бакалавриат;15;177.0;132000;магистратура;19;166.0;140400;7d5e6f1d-0591-46ff-8dc5-f8f45444a8c9;450008, Республика Башкортостан, г.Уфа, ул.Октябрьской революции, 3-а;False;True;https://abitur.bspu.ru/pdf-documents/pdfdocument/05/file_04-2022_150105.pdf
 Белгородский государственный национальный исследовательский университет; 66.8; -2.5; 1460; 2; Да;бакалавриат;17;135.0;81000;магистратура;;;;cf1fddeb-db35-49a5-918c-1c570f2c09c8;308015, Белгородская область, г. Белгород, ул. Победы, д. 85;False;False;http://abitur.bsu.edu.ru/abitur/priem/places/
 Благовещенский государственный педагогический университет; 62.7; -0.9; 427; 0; Нет;бакалавриат;;;;0;0;0;0;d46277ba-4c87-4520-b57f-c5ba739e3171;675000, Амурская область, г. Благовещенск, ул. Ленина, 104;False;True;https://bgpu.ru/abitur/bachelor/#abitur_plan_priema
 Братский государственный университет; 53.2; -5.2; 355; 0; Да;бакалавриат;20;0.0;141300;магистратура;0;0.0;59390;caf6020a-f238-47de-95a8-ccd992a50180;665709, Иркутская область, г.Братск, ул.Макаренко, д.40;False;True;https://brstu.ru/abitur/bachelor
 Брянский государственный университет имени И.Г. Петровского; 71.2; 0.8; 349; 0; Нет;бакалавриат;;;;магистратура;;;;0c5b7ed2-24fb-4a2e-a1f6-8675f55361e7;241036, г. Брянск, ул. Бежицкая,  14;False;True;https://brgu.ru/Abitur/bank/2021/doc/bachelor/2.pdf
 Бурятский государственный университет ; 63.0; -0.9; 792; 0; Да;бакалавриат;19;126.0;107100;магистратура;6;73.0;114100;960a9f73-1bdf-4840-89a5-a1aaf5663bc9;"670000, Республика Бурятия, г.Улан-Удэ, ул.Смолина, 24 ""а""";False;True;https://www.bsu.ru/abit/camp2022/bak2022/plan_bak-2022_ocno/
 Владимирский государственный университет; 64.0; -1.9; 1420; 0; Да;бакалавриат;20;128.0;126000;магистратура;8;30.0;135490;73d9f15a-7469-4a82-8a6f-2d21b03fd7d7;600000, г.Владимир, ул.Горького, 87;False;True;https://prkom.vlsu.ru/plan.html
 Волгоградский государственный университет; 69.0; -0.9; 969; 1; Да;бакалавриат;19;169.0;122000;магистратура;8;89.0;135000;630dd527-b5c6-45bd-81b1-48a876f68301;400062, Волгоградская область, г. Волгоград, просп. Университетский, д. 100;False;False;https://volsu.ru/Abitur/plany-priema.php
 Воронежский государственный педагогический университет; 71.3; -1.2; 573; 0; Нет;бакалавриат;14;0.0;125800;0;0;0;0;98f9d9ef-19cb-423d-842a-ec83158fb33e;394043, г.Воронеж, ул.Ленина, 86, Россия;False;True;http://pk.vspu.ac.ru/kontrolnye-cifry-priema-2015
 Воронежский государственный университет; 74.2; -0.2; 1734; 4; Нет;бакалавриат;14;0.0;125800;магистратура;0;0.0;42380;98f9d9ef-19cb-423d-842a-ec83158fb33e;394043, г.Воронеж, ул.Ленина, 86, Россия;False;True;http://pk.vspu.ac.ru/kontrolnye-cifry-priema-2015
 Горно-Алтайский государственный университет; 60.2; 1; 337; 0; Нет;бакалавриат;24;119.0;142000;0;0;0;0;ca7848f5-a655-4dd5-be23-7923e80eed77;649000, Республика Алтай, г.Горно-Алтайск, ул.Ленкина, 1;False;False;http://abit.gasu.ru/index.php?option=com_content&view=article&id=203&Itemid=523
 Государственный аграрный университет Северного Зауралья ; 56.8; -3.1; 502; 0; Нет;бакалавриат;0;0.0;31220;0;0;0;0;cf33956b-925a-4c2e-916d-274b05a495c9;Российская Федерация, 625003, Тюменская область, г. Тюмень, Республики, д. 7;False;True;http://www.tsaa.ru/priemnaya-komissiya/priyomnaya-kampaniya-2022/dokumentyi-i-polozheniya/9.-kolichestvo-mest-dlya-priema-na-obuchenie-po-razlichnyim-usloviyam-postupleniya-v-ramkax-kontrolnyix-czifr-bez-ukazaniya-czelevoj-kvotyi-i-osoboj-kvotyi
 Государственный университет по землеустройству ; 65.2; -1.3; 425; 0; Нет;бакалавриат;25;119.0;281600;магистратура;;;;9808f8e2-b394-4c16-9c3c-832e1255134d;Российская Федерация, 105064, г. Москва, ул. Казакова, д. 15;;True;https://guz.ru/applicants/priemnaya-kampaniya-2022-2023/
 Грозненский государственный нефтяной технический университет имени академика М.Д. Миллионщикова; 63.6; -0.3; 658; 0; Да;бакалавриат;0;;30000;магистратура;3;0.0;35000;ab1fe8ec-5e0d-48f5-8c27-14c5c97b83af;364051, Чеченская Республика, г.Грозный, пр.им.Х.А.Исаева, 100;False;True;https://gstou.ru/files/priemnaya_kampaniya_2022/kcp_2022.pdf?1649771373
 Дагестанский государственный аграрный университет ; 67.0; -6.4; 324; 0; Нет;бакалавриат;;;;0;0;0;0;19bddf52-9cb6-48b9-b07c-b6c704075dab;367032, Республика Дагестан, г.Махачкала, ул.Магомета Гаджиева, 180;False;True;https://xn--80aaiac8g.xn--p1ai/abitur
 Дагестанский государственный университет ; 63.0; -0.4; 1025; 19; Нет;бакалавриат;0;0.0;101350;магистратура;0;0.0;32440;ae7078a1-9027-4024-af9a-7275afdd1596;367000, Республика Дагестан, г.Махачкала, ул. Батырая, 2, Дворец спорта ДГУ;False;True;http://dgu.ru/Abitur/?id=15247
 Дальневосточный государственный аграрный университет ; 49.2; -1; 411; 0; Нет;бакалавриат;0;0.0;50000;0;0;0;0;4a286e1d-6de1-4230-a16d-6e6508dd702c;675005, Амурская область, г. Благовещенск, ул. Политехничсекая, 86;False;True;https://www.dalgau.ru/upload/iblock/23b/10-Kolichestvo-mest-dlya-priema-na-obuchenie-po-razlichnym-usloviyam-postupleniya.pdf
 Дальневосточный государственный технический рыбохозяйственный университет ; 50.9; -2.7; 399; 0; Нет;бакалавриат;0;0.0;58470;магистратура;0;0.0;70850;63c14fd8-00df-435a-847f-6a23f6c780ab; г. Владивосток, ул. Светланская, 27 (автобусная остановка «Площадь борцов за власть Советов», напротив здания Правительства Приморского края);True;True;https://dalrybvtuz.ru/Abitur/2022/bachelor/kolichestvo-mest-dlya/, https://dalrybvtuz.ru/Abitur/2022/special/kolichestvo-mest-dlya/, https://dalrybvtuz.ru/Abitur/2022/magistr/kolichestvo-mest-dlya/
 Дальневосточный федеральный университет; 73.0; -0.3; 2649; 25; Нет;бакалавриат;25;149.0;210000;магистратура;16;0.0;290000;b1d399f2-cba7-428e-83a0-8f648c08f7aa;690950, Приморский край, г. Владивосток, ул. Суханова, д. 8;True;True;https://www.dvfu.ru/upload/medialibrary/4e4/cmsvctuegg5miib715u5ecte4x9mhmo0/%D0%9A%D0%BE%D0%BB%D0%B8%D1%87%D0%B5%D1%81%D1%82%D0%B2%D0%BE%20%D0%B1%D1%8E%D0%B4%D0%B6%D0%B5%D1%82%D0%BD%D1%8B%D1%85%20%D0%BC%D0%B5%D1%81%D1%82%20%D0%B4%D0%BB%D1%8F%20%D0%BF%D1%80%D0%B8%D0%B5%D0%BC%D0%B0%202022-23%20%D0%BF%D0%BE%20%D0%BF%D1%80%D0%BE%D0%B3%D1%80%D0%B0%D0%BC%D0%BC%D0%B0%D0%BC%20%D0%B1%D0%B0%D0%BA%D0%B0%D0%BB%D0%B0%D0%B2%D1%80%D0%B8%D0%B0%D1%82%D0%B0%20%D0%B8%20%D0%BF%D1%80%D0%BE%D0%B3%D1%80%D0%B0%D0%BC%D0%BC%D0%B0%D0%BC%20%D1%81%D0%BF%D0%B5%D1%86%D0%B8%D0%B0%D0%BB%D0%B8%D1%82%D0%B5%D1%82%D0%B0.pdf
 Забайкальский государственный университет; 58.4; -1.8; 818; 0; Нет;бакалавриат;20;118.0;126500;0;0;0;0;013c6781-1230-49aa-a965-6fb1326f849f;672039, Забайкальский край, город Чита, улица Александро-Заводская, дом 30;True;True;http://entrant.zabgu.ru/?page_id=9
 Ингушский государственный университет ; 62.3; -3.1; 709; 0; Да;бакалавриат;0;0.0;102000;0;0;0;0;af5a9db6-d42a-4243-9763-2c3c203aac5e;386001, Республика Ингушетия, г. Магас, проспект И. Зязикова, д. 7;False;True;http://inggu.ru/abitur/aspirant/Колич.мест%20для%20приема%20-%2029.03.22(26.04.)%20бакалавриат.pdf
 Казанский государственный аграрный университет; 56.7; -3; 360; 0; Да;бакалавриат;14;201.0;86500;0;0;0;0;24606839-a0ca-4b2c-88da-065e5a903d47;420015, Республика Татарстан, г. Казань, ул. Карла Маркса, д. 65;False;False;https://priem.kazgau.ru/spec
 Казанский (Приволжский) федеральный университет; 80.0; -0.5; 2893; 10; Да;бакалавриат;55;199.0;150840;магистратура;27;92.0;160740;cf12a1e1-a102-467f-a2df-f2a96ef1e8ad;420008, Республика Татарстан, г. Казань, ул. Кремлевская, д.18;False;True;https://admissions.kpfu.ru/priem-v-universitet/plan-priema-2021-kolichestvo-mest-vstupitelnye-ispytaniya-i-minimalnye-bally
 Калининградский государственный технический университет; 61.4; -4.6; 515; 0; Да;бакалавриат;25;175.0;135400;магистратура;0;0.0;43000;1d506657-ee65-4df6-8b36-cd7d41c568d9;236022, г.Калининград, Советский проспект, 1;False;True;https://klgtu.ru/abitur/bachelor/
 Кемеровский государственный университет; 65.8; -0.1; 1334; 3; Нет;бакалавриат;;;75025;магистратура;;;;d6de7b26-79ae-45e5-b657-517f90cc3adb;650000, Кемеровская область - Кузбасс, г. Кемерово, ул.Красная, д.6;False;True;https://kemsu.ru/upload/abiturient/kcp_2021_3.pdf
 Крымский федеральный университет имени В.И. Вернадского; 64.7; -2.3; 2520; 2; Да;бакалавриат;50;142.0;112200;магистратура;15;30.0;119200;4a0ab349-a51f-415e-9cad-fb73d0ed1c66;295007, Республика Крым, г.Симферополь, проспект академика Вернадского, 4;True;True;https://priem.cfuv.ru/bachelor/direction https://priem.cfuv.ru/magistr/direction
 Кубанский государственный аграрный университет имени И.Т. Трубилина ; 67.9; 1.4; 1001; 0; Нет;бакалавриат;36;180.0;140400;магистратура;10;51.0;149400;55f0feed-c484-42c0-89b4-1299091335f7;350044, Краснодарский край, г. Краснодар, ул. Калинина, д. 13;True;True;https://kubsau.ru/upload/iblock/591/591181670a0dbc9ba253f62ae560131f.pdf
 Кубанский государственный университет ; 76.6; 0.2; 1766; 7; Да;бакалавриат;30;188.0;134100;магистратура;9;79.0;142600;9476cfaa-2a3e-4135-9b62-954a0e5bbc48;350040, г.Краснодар, ул.Ставропольская, 149;False;True;https://www.kubsu.ru/sites/default/files/insert/page/2022_places_b_0.pdf
 Курганский государственный университет; 63.8; -1; 697; 0; Нет;бакалавриат;0;0.0;34500;магистратура;7;150.0;129790;8e5ea7cf-9552-44f3-89bd-8cb701e7e0c1;640020, г. Курган, ул. Советская, д.63, стр. 4;True;True;https://abit.kgsu.ru/page/3
 Ленинградский государственный университет имени А.С. Пушкина ; 78.4; 0.1; 523; 1; Да;бакалавриат;0;0.0;;магистратура;0;0.0;59;b7680e10-5fdc-468f-af41-d7e64541c446;196605, г.Санкт-Петербург, г.Пушкин, Петербургское шоссе, д.10;False;True;https://lengu.ru/abitur/vsya-informatsiya-o-priyeme-2022-bakalavriat-spetsialitet/vsya-informatsiya-o-priyeme-2022-bakalavriat-magistratura
 Липецкий государственный педагогический университет; 64.9; -0.7; 579; 1; Да;бакалавриат;12;160.0;123790;0;0;0;0;90ab8680-bf5b-4377-8439-7e4dd4b97b4a;398020 г. Липецк, ул. Ленина, 42;False;True;https://lspu-lipetsk.ru/uploads/Abiturient/2022/LGPU_2022_kolichestvo_mest.pdf
 Марийский государственный университет ; 66.9; 1.2; 1277; 0; Нет;бакалавриат;27;123.0;133000;0;0;0;0;45e50d68-f320-4053-a31b-6ee1d1e2f48e;424000, Республика Марий Эл, г. Йошкар-Ола, площадь им. Ленина, д.1;False;True;https://marsu.ru/abitur/pravila/plan_priema/
 Мичуринский государственный аграрный университет; 53.8; -2.2; 501; 0; Нет;бакалавриат;0;0.0;120000;0;0;0;0;10687a60-5296-4867-aaf5-24ad9b42d7db;393760, Тамбовская область, г. Мичуринск, ул. Интернациональная, д. 101;False;True;http://mgau.ru/abitur/bachelor/index.php
 Московский авиационный институт (национальный исследовательский университет); 78.5; 1; 2790; 22; Да;бакалавриат;27;210.0;;0;0;0;0;f43a93df-e3d5-401e-93a4-671357cffc11;125993, г.Москва, Волоколамское шоссе, д.4;True;True;https://mai.ru/science/postgraduate/kcp/
 Московский государственный институт международных отношений; 96.7; 0.5; 405; 102; Да;бакалавриат;16;297.0;540000;0;0;0;0;369c2dcf-ea09-4000-9003-e19dbd0a72c9;119454, г.Москва, проспект Вернадского, дом 76;True;True;https://abiturient.mgimo.ru/upload/ckeditor/files/bac_priem_2021.pdf
 Московский государственный университет имени М.В. Ломоносова; 90.2; -0.6; 3835; 496; Да;бакалавриат;;;;магистратура;;;;c0e2707c-2b2c-4ad6-833f-84d1c7a4f2df;119991,г. Москва, Ленинские Горы,д.1;True;True;http://cpk.msu.ru/files/2021/kcp_bak.pdf
 Московский государственный университет технологий и управления имени К.Г. Разумовского (Первый казачий университет); 74.7; -6.2; 322; 0; Да;бакалавриат;9;178.0;242000;магистратура;0;0.0;91500;259ee278-13b6-4adb-bd30-2d6088d8d58e;109004, г.Москва, Земляной Вал, 73;False;True;https://mgutm.ru/wp-content/uploads/doc/entrant/entry-rules/2021/kolichestvo-mest-dlya-priema-na-obuchenie-v-golovnoj-vuz-po-programmam-vo-v-2022-godu_compressed.pdf
 Национальный исследовательский Томский государственный университет; 80.1; 0.7; 2109; 127; Да;бакалавриат;;;;магистратура;;;;9dcc834c-4241-4fcd-b482-005315a24f28;634050, г. Томск, пр. Ленина 36;True;True;http://abiturient.tsu.ru/sites/default/files/prilozhenie_1.1_bakalavriat_i_specialitet_16032021.pdf
 Национальный исследовательский Томский политехнический университет; 74.8; -3.2; 1809; 54; Нет;бакалавриат;44;161.0;98480;магистратура;25;56.0;109980;29ca77c0-5f4a-41f8-affb-02c84cc42b09;634050, Томская область, г. Томск, просп. Ленина, д. 30;True;True;https://abiturient.tpu.ru/uploads/008e90e7daf883a68d53ac2e7a09ec8f.pdf
 Нижегородский государственный архитектурно-строительный университет; 69.2; -1.3; 732; 0; Нет;бакалавриат;25;188.0;126300;магистратура;0;0.0;71500;e840fa81-67ac-4b9d-9f18-5beb42d239bd;603950 г.Нижний Новгород ул.Ильинская, д. 65;False;True;https://nngasu.ru/entrant/2021_%D0%B1%D0%B0%D0%BA-%D1%81%D0%BF%D0%B5%D1%86_%D0%9F%D1%80%D0%B8%D0%BB%D0%BE%D0%B6%D0%B5%D0%BD%D0%B8%D0%B5%201%20(%D0%BA%D0%BE%D0%BB%D0%B8%D1%87%D0%B5%D1%81%D1%82%D0%B2%D0%BE%20%D0%BC%D0%B5%D1%81%D1%82)___.pdf
 Новосибирский государственный педагогический университет; 69.9; -0.7; 998; 0; Да;бакалавриат;15;163.0;141000;0;0;0;0;f9f63d72-a880-4f50-8e5d-1bf31f526ad7;630126, г. Новосибирск, ул. Вилюйская, д. 28;False;True;https://nspu.ru/abiturientu/
 Пермский государственный национальный исследовательский университет; 71.8; -2.5; 1472; 2; Нет;бакалавриат;25;157.0;142600;магистратура;18;51.0;151700;2801b9c9-a027-4b63-826a-b9aed8d1b98a;614068, г.Пермь, ул.Букирева, 15;False;True;http://www.psu.ru/universitet/normativnye-dokumenty/bazovye-normativnye-dokumenty/pravila-priema/pravila-priema-v-2022-godu-bakalavriat-specialitet#p1
 Петрозаводский государственный университет; 70.2; 0.6; 1336; 1; Нет;бакалавриат;13;151.0;158300;магистратура;12;40.0;167900;ec58ccf8-3d3b-4e3a-9a34-50d033761092;185910, Республика Карелия, г. Петрозаводск, пр. Ленина, 33;True;False;https://petrsu.ru/page/education/bakalavriat_i_spec/priemnaya-kampaniya/kolitchesvto-byuzhdetnyh-mest
 Поволжский государственный технологический университет ; 68.3; 2.4; 1301; 0; Нет;бакалавриат;23;146.0;114600;магистратура;16;20.0;121250;9c9410df-579c-43e3-bb09-747054f829f0;424000, Республика Марий Эл, г.Йошкар-Ола, пл. Ленина, д.3;False;True;https://dod.volgatech.net/documents/
 Российский государственный геологоразведочный университет имени Серго Орджоникидзе ; 67.1; -0.8; 382; 0; Да;бакалавриат;50;205.0;219500;магистратура;15;65.0;249950;d8903dc5-299d-4925-a4ba-4de9416c560d;117997, г.Москва, ул. Миклухо-Маклая,  д. 23;False;True;https://mgri.ru/commission/gid-po-spetsialnostyam-mgri/
 Российский государственный гидрометеорологический университет ; 69.5; -0.3; 466; 0; Нет;бакалавриат;;;;магистратура;;;;f44e3e27-2211-4757-8829-24e75e6c53bd;192007 , Санкт-Петербург, ул. Воронежская, д.79;True;True;http://dovus.rshu.ru/file2984.pdf
 Российский государственный университет нефти и газа имени И.М. Губкина ; 83.0; 1.1; 1240; 39; Да;бакалавриат;22;247.0;278000;0;0;0;0;3b68c882-8089-4f13-87a2-a2a1c1912ac0;РГУ нефти и газа (НИУ) имени И.М. Губкина, 119991, Город Москва, проспект Ленинский, дом 65,  корпус 1;True;True;https://gubkin.ru/info/enrollee/admission_board/postupayushchim-v-bakalavriat/priyem-na-ochnuyu-formu-obucheniya/Pravila_priema__2021_b1__.pdf
 Российский университет дружбы народов ; 86.3; 3.5; 1029; 202; Да;бакалавриат;0;0.0;101150;магистратура;0;0.0;98550;e73bd5e9-f67c-48fe-8513-6ed08b1b3d10;117198, г.Москва, ул. Миклухо-Маклая, д.6;False;True;http://admission.rudn.ru/?pagec=5970
 Рязанский государственный университет имени С.А. Есенина; 70.4; -2.6; 598; 0; Да;бакалавриат;12;142.0;130000;магистратура;8;80.0;58000;83c396a4-2ec8-4bf3-ab8f-6c9019de0985;390000, г. Рязань, ул. Свободы, д. 46;False;True;https://www.rsu.edu.ru/admission/rules-docs/plan-2/
 Санкт-Петербургский горный университет; 80.8; 2.3; 1831; 64; Нет;бакалавриат;40;253.0;400000;магистратура;10;205.0;400000;37c9158f-99fb-4790-a7bc-749dd3ba2c45;199106, г.Санкт-Петербург, 21-я линия, д.2;True;True;https://priem.spmi.ru/sites/default/files/manager/03.PlanPriema/KCP.pdf
 Санкт-Петербургский государственный лесотехнический университет имени С.М. Кирова; 75.0; 0; 543; 0; Нет;бакалавриат;;;;0;0;0;0;cdb5222f-5110-4e24-bd31-5f51766bc907;194021, г.Санкт-Петербург, Институтский пер., д.5 литера У;False;True;https://spbftu.ru/wp-content/uploads/2021/06/200od.pdf
 Санкт-Петербургский государственный университет; 92.0; 0.1; 2136; 366; Да;бакалавриат;;;;магистратура;2;0.0;23500;cdb5222f-5110-4e24-bd31-5f51766bc907;194021, г.Санкт-Петербург, Институтский пер., д.5 литера У;False;True;https://spbftu.ru/wp-content/uploads/2021/06/200od.pdf
 Саратовский государственный аграрный университет имени Н.И. Вавилова; 55.2; -2.9; 758; 0; Нет;бакалавриат;50;99.0;118450;магистратура;30;30.0;125410;b8bbeb55-c6b3-4603-a9fa-a3b962ea32a5;410012, г. Саратов, Театральная площадь, 1;False;True;http://sgau.ru/abitur/bachelor/#abitur_plan_priema
 Саратовский государственный технический университет; 66.5; 1.8; 1098; 0; Нет;бакалавриат;15;150.0;113080;магистратура;0;70.0;57230;06d0f532-f5cb-4cfe-abbf-05f72e0cc05a;410054, г.Саратов, ул.Политехническая, д. 77;True;True;https://www.sstu.ru/upload/medialibrary/86b/Kol_mest_VO_2021_bak_i_spets_mart_21-_2_.docx
 Саратовский национальный исследовательский государственный университет имени Н. Г. Чернышевского; 69.9; 1.2; 1568; 3; Да;бакалавриат;;;;магистратура;;;;c8963b8c-56ef-4480-8fd1-69d204ca9855;410012, г.Саратов, ул.Астраханская, 83;False;True;https://www.sgu.ru/admission/priemnaya-kampaniya-2022
 Сахалинский государственный университет ; 58.8; -1.3; 327; 1; Нет;бакалавриат;0;0.0;54000;магистратура;18;50.0;;a4417690-df58-449b-b340-84e597c768f0;693008, Сахалинская область, г.Южно-Сахалинск, ул.Ленина, д.290;False;True;sakhgu.ru/wp-content/uploads/page/record_122756/2021_01/%D0%B1-%D0%BA%D0%BE%D0%BB%D0%B8%D1%87%D0%B5%D1%81%D1%82%D0%B2%D0%BE-%D0%BC%D0%B5%D1%81%D1%82-%D0%B4%D0%BB%D1%8F-%D0%BF%D1%80%D0%B8%D0%B5%D0%BC%D0%B0-%D0%BD%D0%B0-%D0%BE%D0%B1%D1%83%D1%87%D0%B5%D0%BD%D0%B8%D0%B5-%D0%BF%D0%BE-%D1%80%D0%B0%D0%B7%D0%BB%D0%B8%D1%87%D0%BD%D1%8B%D0%BC-%D1%83%D1%81%D0%BB%D0%BE%D0%B2%D0%B8%D1%8F%D0%BC-%D0%BF%D0%BE%D1%81%D1%82%D1%83%D0%BF%D0%BB%D0%B5%D0%BD%D0%B8%D1%8F-1.docx
 Севастопольский государственный университет; 65.8; -0.6; 1724; 0; Да;бакалавриат;27;120.0;114000;магистратура;0;0.0;45000;9821ffaf-6064-4bda-8881-64db50b60b55;299053, г. Севастополь, ул. Университетская, д. 33;True;True;https://welcome.sevsu.ru/specialnosti/
