 Сибирский государственный индустриальный университет ; 65.3; 2.3; 1095; 1; Нет;бакалавриат;20;120.0;140350;0;0;0;0;aa29b86f-5cf0-418b-9b31-fa9d4421f3e9;654007, Кемеровская область - Кузбасс, г. Новокузнецк, Центральный р-н, ул. Кирова, зд. 42;False;True;https://www.sibsiu.ru/abiturientu/AbitReport/index2.php?sphrase_id=454970
 Сибирский государственный университет геосистем и технологий ; 67.8; -1; 489; 0; Нет;бакалавриат;0;0.0;40812;магистратура;0;0.0;47376;56a52ade-1d79-499e-9a26-0d364402e32e;630108, г. Новосибирск, ул. Плахотного, д. 10;False;True;https://sgugit.ru/abitur/bachelor/#abitur_plan_priema
 Сибирский федеральный университет; 70.1; -1; 3337; 8; Да;бакалавриат;80;125.0;176934;магистратура;37;41.0;188584;ed090e19-9cf6-40f3-b40d-d4f69a2aabea;660041, Красноярский край, г. Красноярск, просп. Свободный, д. 79;True;True;https://admissions.sfu-kras.ru/exams
 Ставропольский государственный аграрный университет; 62.2; 0.8; 565; 0; Да;бакалавриат;4;145.0;32000;магистратура;0;0.0;37000;c1fa38a6-9015-43a7-8756-8cbab8856eb5;переулок Зоотехнический, 12, г. Ставрополь, Ставропольский край, 355017;False;True;http://www.stgau.ru/abiturient/pologenie/docs/2022/10.1.pdf http://www.stgau.ru/abiturient/pologenie/docs/2022/10.2.pdf
 Сыктывкарский государственный университет; 67.6; 0.4; 750; 1; Нет;бакалавриат;15;125.0;180550;магистратура;10;60.0;191900;4b77dbc6-0450-4bfa-878e-d153aaee32fb;167001, Республика Коми, г.Сыктывкар, Октябрьский пр., д.55;False;True;https://syktsu.ru/abitur/
 Тамбовский государственный университет имени Г.Р. Державина; 67.6; -0.9; 929; 0; Нет;бакалавриат;16;172.0;114000;магистратура;6;15.0;121000;eeaec74b-1739-42e4-9c36-02c2329fc9f9;392036, Центральный федеральный округ, Тамбовская область, г. Тамбов, ул. Интернациональная, 33;True;False;http://abiturient.tsutmb.ru/normativno_pravovoe_obespechenie_priema_2020_2021_goda/
 Тверской государственный университет; 68.6; -3.5; 856; 0; Да;бакалавриат;25;;130380;магистратура;11;;138870;b67da480-580c-4c77-b250-85a53beb6942;170100, г. Тверь, ул.Желябова, 33;False;True;https://priem.tversu.ru/
 Томский государственный университет систем управления и радиоэлектроники; 68.7; -0.3; 1236; 3; Нет;бакалавриат;13;183.0;76226;0;0;0;0;86d8ad91-16a5-492e-89c4-f89e877684aa;634050, Россия, г. Томск, пр. Ленина, 40;False;True;https://abiturient.tusur.ru/storage/139741/KCP-byudzhet_i_PVZ_ochnoe_na_2021_na_AJT%2029_10.pdf
 Тюменский государственный университет; 77.9; -0.8; 1408; 18; Да;бакалавриат;40;166.0;158947;магистратура;36;48.0;175928;768dfccd-97bb-4534-85e4-e048c214b9c4;625003, Тюменская область, г. Тюмень, ул. Семакова, д. 10;False;False;https://abiturient.utmn.ru/postuplenie/priemnaya-kampaniya-2022/kolichestvo-mest/
 Удмуртский государственный университет ; 67.2; -1.6; 1264; 6; Да;бакалавриат;30;163.0;131700;магистратура;30;163.0;131700;a6558ddd-86a6-4a6a-83bc-f678ef69a53d;426034, Удмуртская Республика, г. Ижевск, ул. Университетская, д. 1;False;False;https://udsu.ru/admissions/2022/vysshee-obrazovanie-bakalavriat-i-spetsialitet/quantity_2022
 Ульяновский государственный университет; 66.3; -1; 853; 0; Нет;бакалавриат;18;163.0;112840;0;0;0;0;918d7167-278c-444d-853f-dfa0d42c7908;432017, г.Ульяновск, ул.Л.Толстого, 42;False;True;http://abiturient.ulsu.ru/tiles/general/
 Уральский государственный аграрный университет ; 63.2; 2.4; 458; 0; Нет;бакалавриат;0;0.0;49500;магистратура;0;0.0;45000;78e0aa76-2b42-4fdf-9e7e-228e2fc20a4a;457100, Челябинская область, г. Троицк, ул. Гагарина, дом 13;False;False;https://юургау.рф/abitur/bachelor/#abitur_plan_priema
 Уральский государственный горный университет ; 67.9; 0.4; 667; 0; Да;бакалавриат;24;118.0;143000;магистратура;0;0.0;65000;caa1c0f9-4e76-4dc2-bb21-280dea64da0c;620144, Свердловская область, г.Екатеринбург, ул.Куйбышева, д.30;False;True;http://abit.ursmu.ru/importante/kontrolnye-cifry-priema.html
 Уральский государственный лесотехнический университет ; 64.0; -0.6; 683; 0; Нет;бакалавриат;0;199.0;45000;0;0;0;0;5a8f97c4-23cc-440e-87e3-92d3e26715d1;620100, Свердловская область, г. Екатеринбург, ул. Сибирский тракт, д. 37;False;True;http://usfeu.ru/abiturientu/bakalavriat/kolichestvo-mest/
 Уральский государственный педагогический университет ; 74.3; -0.5; 699; 2; Нет;бакалавриат;10;169.0;138826;0;0;0;0;7d5b14c1-9710-49e2-8182-0e33c95d7d57;454080, г.Челябинск, пр. Ленина, 69;False;False;https://www.cspu.ru/abitur/bachelor/#abitur_plan_priema
 Уральский федеральный университет имени Б.Н. Ельцина; 76.2; -1.4; 4422; 122; Да;бакалавриат;30;222.0;130400;магистратура;15;71.0;126400;f255a4e8-15cf-45d0-a121-19f6f61d0c5d;620002, Свердловская область, г. Екатеринбург, ул. Мира, д. 19;True;True;https://urfu.ru/fileadmin/user_upload/urfu.ru/documents/applicant/2021/postuplenie-vo/Plan_priema_bakalavriat_specialitet_2021.pdf
 Уфимский государственный авиационный технический университет; 69.2; -1.2; 1404; 7; Нет;бакалавриат;0;0.0;123540;0;0;0;0;6119c816-9894-47f3-8d85-188bba571e88;450000, Республика Башкортостан, г. Уфа, ул. К. Маркса, д. 12;True;True;https://ugatu.su/abitur/bachelor-and-specialist/admission-plan/2022/
 Ухтинский государственный технический университет; 60.4; 2.6; 604; 0; Нет;бакалавриат;20;119.0;;0;0;0;0;9b9a6608-acde-43d9-a9da-8bc7dc2de88f;169300, Республика Коми, г.Ухта, ул. Первомайская, д. 13;False;True;https://www.ugtu.net/abitur/bachelor
 Челябинский государственный университет; 71.9; -0.3; 819; 12; Нет;бакалавриат;0;0.0;45000;магистратура;0;0.0;50000;b265f70b-d35d-45f0-ab0a-eec7ad99dad4;454001, Челябинская область, город Челябинск, улица Братьев Кашириных, дом 129;False;True;https://www.csu.ru/roles/prospective-students/Priem/bachelor/PriemMest.aspx
 Чувашский государственный университет имени И.Н. Ульянова ; 70.3; 0.9; 1296; 1; Да;бакалавриат;0;0.0;25500;0;0;0;0;8a6c9f76-166b-4805-8c42-fdf474e8aff6;428015, г.Чебоксары  Московский проспект,15;False;True;https://abiturient.chuvsu.ru/urovni/bakalavriat/byudzhetnye-mesta
 Югорский государственный университет ; 64.6; -3.3; 715; 2; Да;бакалавриат;28;125.0;140000;магистратура;18;40.0;212000;60a04de5-0800-4841-a91a-877f3159a95f;628012, Ханты-Мансийский атономный округ-Югра, г.Ханты-Мансийск, ул. Чехова, д. 16;True;True;https://www.ugrasu.ru/upload/iblock/010/010b1dd638916fed101f050d821497af.pdf
 Южно-Уральский государственный аграрный университет ; 52.5; -0.2; 445; 0; Да;бакалавриат;0;0.0;49500;магистратура;0;0.0;45000;78e0aa76-2b42-4fdf-9e7e-228e2fc20a4a;457100, Челябинская область, г. Троицк, ул. Гагарина, дом 13;False;False;https://юургау.рф/abitur/bachelor/#abitur_plan_priema
 Южный федеральный университет; 76.7; 0.2; 3088; 34; Да;бакалавриат;22;194.0;130000;магистратура;20;50.0;133000;496e4998-457b-4fed-bc13-18b6158ac498;344006, г.Ростов-на-Дону, ул.Большая Садовая, д. 105/42;True;True;https://sfedu.ru/www/stat_pages22.show?p=ABT/N8206/P
